{
  "items": [{
    "id": "p1", "name": "Lunar Waves", "genre": "Electronic", "country": "USA", "bio": "Lunar Waves is a electronic project that blends rhythmic sets with detailed live production."},{
    "id": "p2", "name": "Neon Horizon", "genre": "Indie", "country": "UK", "bio": "Neon Horizon is a indie project that focuses on dynamic stage energy and clean arrangements."},{
    "id": "p3", "name": "Desert Echo", "genre": "Alternative", "country": "Australia", "bio": "Desert Echo is a alternative project that mixes melodic hooks with festival-ready live performance."},{
    "id": "p4", "name": "Solar Nomads", "genre": "Hip-Hop", "country": "Canada", "bio": "Solar Nomads is a hip-hop project that builds atmosphere through layered instrumentation and timing."},{
    "id": "p5", "name": "Mirage Bloom", "genre": "Experimental", "country": "Germany", "bio": "Mirage Bloom is a experimental project that delivers a set shaped for outdoor festival stages."},{
    "id": "p6", "name": "Crystal Coyote", "genre": "Ambient", "country": "France", "bio": "Crystal Coyote is a ambient project that combines tight structure with spontaneous live moments."},{
    "id": "p7", "name": "Midnight Caravan", "genre": "Synth-pop", "country": "Mexico", "bio": "Midnight Caravan is a synth-pop project that leans on groove-driven transitions and strong pacing."},{
    "id": "p8", "name": "Velvet Comet", "genre": "World Fusion", "country": "Spain", "bio": "Velvet Comet is a world fusion project that pairs genre roots with a modern live approach."},{
    "id": "p9", "name": "Static Palms", "genre": "Electronic", "country": "Japan", "bio": "Static Palms is a electronic project that keeps a clear sound profile with audience-focused flow."},{
    "id": "p10", "name": "Golden Circuit", "genre": "Indie", "country": "Brazil", "bio": "Golden Circuit is a indie project that moves between introspective passages and high-energy peaks."},{
    "id": "p11", "name": "Blue Ember", "genre": "Alternative", "country": "Netherlands", "bio": "Blue Ember is a alternative project that blends rhythmic sets with detailed live production."},{
    "id": "p12", "name": "Dustline Choir", "genre": "Hip-Hop", "country": "Czech Republic", "bio": "Dustline Choir is a hip-hop project that focuses on dynamic stage energy and clean arrangements."},{
    "id": "p13", "name": "Prism Jackals", "genre": "Experimental", "country": "USA", "bio": "Prism Jackals is a experimental project that mixes melodic hooks with festival-ready live performance."},{
    "id": "p14", "name": "Electric Saguaro", "genre": "Ambient", "country": "UK", "bio": "Electric Saguaro is a ambient project that builds atmosphere through layered instrumentation and timing."},{
    "id": "p15", "name": "The Sand Frequencies", "genre": "Synth-pop", "country": "Australia", "bio": "The Sand Frequencies is a synth-pop project that delivers a set shaped for outdoor festival stages."},{
    "id": "p16", "name": "Nova Caravan", "genre": "World Fusion", "country": "Canada", "bio": "Nova Caravan is a world fusion project that combines tight structure with spontaneous live moments."},{
    "id": "p17", "name": "Amber Signals", "genre": "Electronic", "country": "Germany", "bio": "Amber Signals is a electronic project that leans on groove-driven transitions and strong pacing."},{
    "id": "p18", "name": "Wild Mesa", "genre": "Indie", "country": "France", "bio": "Wild Mesa is a indie project that pairs genre roots with a modern live approach."},{
    "id": "p19", "name": "Cactus Radio", "genre": "Alternative", "country": "Mexico", "bio": "Cactus Radio is a alternative project that keeps a clear sound profile with audience-focused flow."},{
    "id": "p20", "name": "Echo Atlas", "genre": "Hip-Hop", "country": "Spain", "bio": "Echo Atlas is a hip-hop project that moves between introspective passages and high-energy peaks."}],
  "count": 60, "page": 1, "pageSize": 20
}